{
  "$schema": "ultra-baseline-reconciliation-v1",
  "change_id": "change-001",
  "baseline_id": "baseline-001",
  "baseline_updates": [],
  "semantic_changes": [],
  "resolved_gap_ids": [],
  "resolved_unknowns": [],
  "verification": [
    {
      "name": "reconciliation check",
      "command": "node --test",
      "status": "pass",
      "evidence": "All accepted behavior remains represented by the current baseline."
    }
  ],
  "semantic_no_change_reason": "The delivered change does not alter stable baseline semantics."
}
